chain layer,analytical price,unit,period,observations,products,mean,sd,min-max,brands / companies / buyers,model role
farm-gate raw milk,farm-gate raw milk price,UAH/kg,2015-01-01 to 2026-03-01,131,raw_milk,9.68,3.86,4.05-19.10,enterprise farm-gate series; regional rows kept for dispersion only,main H1 upstream variable
processor-level sale,industrial producer price converted to processor-level price,UAH/kg,2013-01-01 to 2026-03-01,954,"butter, drinking_milk, hard_cheese, kefir, skim_milk_powder, sour_cream",69.09,63.85,5.62-316.86,six SSSU processor product rows; firm names not observed,main H1 downstream and H2 upstream variable
official consumer sale,official average consumer price,UAH/kg,2017-01-01 to 2026-03-01,333,"drinking_milk, soft_cheese, sour_cream",84.50,56.27,17.93-241.17,national consumer average; no brand or retailer identifiers,main H2 downstream benchmark
institutional procurement,repaired ProZorro lot unit price,UAH/kg,2023-01-02 to 2026-04-29,16531,"butter, condensed_milk, cottage_cheese, cream, drinking_milk, hard_cheese, kefir, skim_milk_powder",193.39,154.14,10.00-805.00,"1,125 winning suppliers; 2,961 procuring organizers",H1/H2 procurement mechanism and wartime extension
retail SKU-day sale,observed package price; UAH/kg used only where reliable,UAH/package; UAH/kg subset,2025-10-21 to 2026-01-08,69308,"butter, condensed_milk, cottage_cheese, cream, drinking_milk, hard_cheese, kefir, other_dairy",75.46,79.48,"6.49-2,399.00","353 brands; 2,829 SKUs; retailers: novus, silpo",H2 retail/discount mechanism; 990 reliable UAH/kg rows
